{
  "$schema": "https://json-schema.org/draft/2020-12/schema",
  "$id": "https://wdf.dev/schemas/0.1/manifest.schema.json",
  "title": "WDF Core 0.1 — manifest.json",
  "description": "Package manifest, at the root of every .wdf archive (WDF Core 0.1 §manifest).",
  "type": "object",
  "additionalProperties": false,
  "required": ["wdf", "id", "title", "language", "created", "modified", "entry"],
  "properties": {
    "wdf": {
      "description": "Version of the WDF Core spec the package conforms to.",
      "const": "0.1"
    },
    "id": {
      "description": "Stable document identifier (URN UUID). Used as the authority part of wdf: citation URIs.",
      "type": "string",
      "pattern": "^urn:uuid:[0-9a-f]{8}-[0-9a-f]{4}-[0-9a-f]{4}-[0-9a-f]{4}-[0-9a-f]{12}$"
    },
    "title": {
      "type": "string",
      "minLength": 1
    },
    "language": {
      "description": "Primary language of the document (BCP 47).",
      "type": "string",
      "pattern": "^[a-zA-Z]{2,3}(-[a-zA-Z0-9]{2,8})*$"
    },
    "authors": {
      "type": "array",
      "minItems": 1,
      "items": {
        "type": "object",
        "additionalProperties": false,
        "required": ["name"],
        "properties": {
          "name": { "type": "string", "minLength": 1 },
          "role": { "type": "string", "minLength": 1 }
        }
      }
    },
    "created": {
      "type": "string",
      "format": "date-time"
    },
    "modified": {
      "type": "string",
      "format": "date-time"
    },
    "entry": {
      "description": "Entry document. Fixed in WDF Core 0.1.",
      "const": "content/index.html"
    },
    "resources": {
      "description": "Every package resource other than the required files. Paths are package-relative; path segments start with an alphanumeric character (no dotfiles, no traversal).",
      "type": "array",
      "items": {
        "type": "object",
        "additionalProperties": false,
        "required": ["path", "mediaType"],
        "properties": {
          "path": {
            "type": "string",
            "pattern": "^(content|data)(/[A-Za-z0-9][A-Za-z0-9._-]*)+$"
          },
          "mediaType": {
            "type": "string",
            "pattern": "^[a-z]+/[A-Za-z0-9.+-]+$"
          }
        }
      }
    },
    "datasets": {
      "description": "Typed datasets under data/, referenced by tables via data-wdf-dataset.",
      "type": "array",
      "items": {
        "type": "object",
        "additionalProperties": false,
        "required": ["path", "schema"],
        "properties": {
          "path": {
            "type": "string",
            "pattern": "^data(/[A-Za-z0-9][A-Za-z0-9._-]*)+\\.json$"
          },
          "title": { "type": "string", "minLength": 1 },
          "schema": {
            "type": "object",
            "additionalProperties": false,
            "required": ["columns"],
            "properties": {
              "columns": {
                "type": "array",
                "minItems": 1,
                "items": {
                  "type": "object",
                  "additionalProperties": false,
                  "required": ["name", "type"],
                  "properties": {
                    "name": { "type": "string", "minLength": 1 },
                    "type": {
                      "enum": ["string", "integer", "number", "boolean", "date"]
                    }
                  }
                }
              }
            }
          }
        }
      }
    },
    "extensions": {
      "description": "Versioned extensions used by this document. Empty in WDF Core 0.1; extension content is outside the core spec.",
      "type": "array",
      "items": {
        "type": "object",
        "required": ["name"],
        "properties": {
          "name": { "type": "string", "minLength": 1 },
          "version": { "type": "string", "minLength": 1 }
        }
      }
    }
  }
}
